{
  "isOpen": true,
  "title": "Test About Page",
  "logoPath": "./logo.png",
  "description": "A long description about the page. Lorem ipsum dolor sit amet, consectetur adipiscing elit. Vestibulum porttitor enim sit amet odio euismod, vitae porta enim vestibulum. Fusce pulvinar, libero sed posuere elementum, turpis risus facilisis diam, in ornare enim quam sit amet dui. Vestibulum luctus nibh justo, a fermentum nisl efficitur eu. Fusce lobortis, orci et rhoncus semper, mauris neque pulvinar magna, vitae faucibus turpis sapien at metus. In imperdiet ligula tellus, eu vulputate nunc laoreet a. Lorem ipsum dolor sit amet, consectetur adipiscing elit. Donec pellentesque imperdiet odio, sed facilisis elit fringilla vitae. Fusce lectus orci, luctus quis facilisis faucibus, dapibus ac justo. Phasellus a faucibus mauris. Ut et maximus quam. Pellentesque habitant morbi tristique senectus et netus et malesuada fames ac turpis egestas. Proin vel enim mattis, luctus arcu nec, lobortis metus. Suspendisse potenti. Etiam semper risus vel maximus finibus.\n\nIn viverra a ipsum sed vestibulum. Nunc posuere orci vel augue vestibulum, sed semper dolor tincidunt. Nam congue sagittis metus quis gravida. Morbi fringilla felis leo, eu eleifend nulla suscipit a. Sed bibendum orci non enim sollicitudin, eu luctus elit gravida. Nulla in ligula sed dolor tristique molestie ac fringilla nulla. Vestibulum sodales aliquam rhoncus. Aenean sit amet turpis accumsan, sagittis magna ut, facilisis nisi. Sed et elementum ipsum. Duis cursus ac elit in semper. Proin urna justo, placerat in malesuada vel, maximus eu purus.",
  "link": "https://natural-resources.canada.ca/science-data/science-research/research-centres/canada-centre-mapping-earth-observation"
}